{
  "$schema": "https://json-schema.org/draft/2020-12/schema",
  "$id": "https://github.com/agsiqueira/work-at-heights/integration/vr/schemas/vr-event-log.schema.json",
  "title": "safeheight.vr_event_log 1.5",
  "description": "Written by the SafeHeight VR (Meta Quest 3, Unreal Engine 5.7) at the end of every session, including partial ones. 1.5 only adds fields to 1.4 (plan, scenario_config, weather.said_vs_did); this schema accepts both. Times are seconds since the learner touched the training in the start menu, or null if the event did not happen. Fields not listed here may exist and are ignored by WAH.",
  "type": "object",
  "required": ["schema", "schema_version", "session_id", "generated_at_utc", "completed", "end_reason", "learner_profile", "duration_s", "start", "steps", "ppe", "lifeline", "inspection", "weather", "supervisor_pressure", "descent", "safety_supervisor_interventions", "stopped_after_intervention", "pedagogical_pauses", "director", "final_decision", "safety_classification", "verdict"],
  "properties": {
    "schema": { "const": "safeheight.vr_event_log" },
    "schema_version": { "type": "string", "pattern": "^1\\.([4-9]|[1-9][0-9]{1,2})$" },
    "session_id": { "type": "string", "pattern": "^[0-9A-Fa-f]{32}$", "description": "Random id of the run; WAH de-duplicates resent reports by it." },
    "generated_at_utc": { "type": "string", "pattern": "^\\d{4}-\\d{2}-\\d{2}T\\d{2}:\\d{2}:\\d{2}(\\.\\d{1,3})?Z$" },
    "completed": { "type": "boolean", "description": "true when the learner reached the results screen." },
    "end_reason": { "enum": ["Results", "OperatorReset", "Timeout", "HeadsetRemoved"] },
    "app": { "type": "object" },
    "learner_profile": {
      "type": "object",
      "required": ["level", "source"],
      "properties": {
        "level": { "enum": ["Basic", "Intermediate", "Expert"] },
        "focus": { "type": "string" },
        "source": { "enum": ["fixed_in_xr", "wah_plan"], "description": "fixed_in_xr: no plan received (the 1.4 behavior)." }
      }
    },
    "duration_s": { "type": "number", "minimum": 0 },
    "start": {
      "type": "object",
      "required": ["trigger", "practice_started_at_s"],
      "properties": {
        "trigger": { "enum": ["training_menu", "tablet"] },
        "training_id": { "type": "string" },
        "practice_started_at_s": { "$ref": "#/$defs/time" }
      }
    },
    "steps": {
      "type": "array",
      "maxItems": 32,
      "items": {
        "type": "object",
        "required": ["id", "started_at_s", "ended_at_s", "skipped_by_operator"],
        "properties": {
          "id": { "type": "string", "minLength": 1, "maxLength": 40, "description": "Welcome, Equipment, Platform, Lanyard, Rule, Ascent, Photo, Rain, Descent, Results." },
          "started_at_s": { "$ref": "#/$defs/time" },
          "ended_at_s": { "$ref": "#/$defs/time" },
          "skipped_by_operator": { "type": "boolean" }
        }
      }
    },
    "ppe": {
      "type": "object",
      "required": ["required", "equipped", "missed", "wrong_item_attempts", "all_correct"],
      "properties": {
        "required": { "$ref": "#/$defs/labels" },
        "equipped": { "$ref": "#/$defs/labels" },
        "missed": { "$ref": "#/$defs/labels" },
        "wrong_item_attempts": { "type": "integer", "minimum": 0, "maximum": 1000 },
        "all_correct": { "type": "boolean" }
      }
    },
    "platform_check": { "type": "object" },
    "lifeline": {
      "type": "object",
      "required": ["connected_before_ascent"],
      "properties": { "connected_before_ascent": { "type": ["boolean", "null"] } }
    },
    "inspection": {
      "type": "object",
      "required": ["photo_goal", "photos_sent"],
      "properties": {
        "photo_goal": { "type": "integer", "minimum": 0, "maximum": 100 },
        "photos_sent": { "type": "integer", "minimum": 0, "maximum": 100 }
      }
    },
    "weather": {
      "type": "object",
      "required": ["rain_started_at_s", "rain_ended_at_s", "stopped_photos", "photo_during_rain", "first_photo_during_rain_at_s", "photo_after_rain", "declared_decision", "declared_at_s", "answer_feedback"],
      "properties": {
        "rain_started_at_s": { "$ref": "#/$defs/time" },
        "rain_ended_at_s": { "$ref": "#/$defs/time" },
        "stopped_photos": { "type": "boolean" },
        "photo_during_rain": { "type": "boolean", "description": "Critical." },
        "first_photo_during_rain_at_s": { "$ref": "#/$defs/time" },
        "photo_after_rain": { "type": "boolean" },
        "declared_decision": { "enum": ["keep_inspecting", "stop_and_wait", "descend_now", "no_answer", null], "description": "Tablet answer to the paused storm question; null if the storm was not reached." },
        "declared_at_s": { "$ref": "#/$defs/time" },
        "answer_feedback": { "type": ["boolean", "null"] },
        "said_vs_did": { "enum": ["consistent", "inconsistent", null], "description": "1.5. declared_decision compared with supervisor_pressure.response; null without a declared action or before the foreman's call. Reference: saidVsDid() in src/vr-contract.cjs." }
      }
    },
    "supervisor_pressure": {
      "type": "object",
      "required": ["played", "at_s", "response"],
      "properties": {
        "speaker": { "type": "string" },
        "played": { "type": "boolean" },
        "at_s": { "$ref": "#/$defs/time" },
        "line": { "type": "string" },
        "response": { "enum": ["stopped_and_waited", "continued_inspection", "descended_during_rain", "photographed_before_pressure", "not_reached"] }
      }
    },
    "descent": {
      "type": "object",
      "required": ["started_at_s", "reached_ground_at_s", "during_rain", "premature"],
      "properties": {
        "started_at_s": { "$ref": "#/$defs/time" },
        "reached_ground_at_s": { "$ref": "#/$defs/time" },
        "during_rain": { "type": "boolean", "description": "Critical." },
        "premature": { "type": "boolean" }
      }
    },
    "safety_supervisor_interventions": {
      "type": "array",
      "maxItems": 100,
      "items": {
        "type": "object",
        "required": ["type", "at_s"],
        "properties": {
          "type": { "enum": ["photo", "descent"] },
          "at_s": { "$ref": "#/$defs/time" },
          "stopped_after_intervention": { "type": ["boolean", "null"] },
          "pause_s": { "type": "number", "minimum": 0 }
        }
      }
    },
    "stopped_after_intervention": { "type": ["boolean", "null"] },
    "pedagogical_pauses": {
      "type": "array",
      "maxItems": 100,
      "items": {
        "type": "object",
        "required": ["type", "at_s", "duration_s"],
        "properties": {
          "type": { "type": "string", "pattern": "^([Qq]uestion|[Ee]rror_(descent|photo))$", "description": "question, error_descent, error_photo. Some 1.4 builds wrote \"Question\"; 1.5 writes lowercase." },
          "at_s": { "$ref": "#/$defs/time" },
          "duration_s": { "$ref": "#/$defs/time" }
        }
      }
    },
    "director": {
      "type": "object",
      "required": ["incident_keys", "critical_failures"],
      "properties": {
        "incident_keys": { "type": "array", "items": { "type": "string", "minLength": 1, "maxLength": 80 } },
        "critical_failures": { "type": "integer", "minimum": 0, "maximum": 1000 }
      }
    },
    "final_decision": { "enum": ["stopped_waited_descended", "continued_inspection_in_rain", "descended_during_rain", "incomplete"] },
    "safety_classification": { "enum": ["safe", "partially_safe", "unsafe", "incomplete"] },
    "verdict": { "enum": ["safe_decisions", "review_needed", "critical_risk", "time_up", "incomplete"] },
    "plan": {
      "description": "1.5. Copy of the plan this session ran with; null when no plan was received.",
      "oneOf": [
        { "type": "null" },
        {
          "type": "object",
          "required": ["plan_id", "pseudonym", "phase", "attempt"],
          "properties": {
            "plan_id": { "type": "string", "pattern": "^[0-9a-f]{8}-[0-9a-f]{4}-[0-9a-f]{4}-[0-9a-f]{4}-[0-9a-f]{12}$" },
            "pseudonym": { "type": "string", "pattern": "^[A-Za-z0-9_-]{4,64}$" },
            "phase": { "enum": ["pre_test", "post_test"] },
            "attempt": { "type": "integer", "minimum": 1, "maximum": 20 }
          }
        }
      ]
    },
    "scenario_config": { "$ref": "#/$defs/scenario_config" }
  },
  "if": { "properties": { "schema_version": { "const": "1.4" } } },
  "else": {
    "required": ["plan", "scenario_config"],
    "properties": { "weather": { "required": ["said_vs_did"] } }
  },
  "allOf": [
    {
      "if": { "required": ["plan"], "properties": { "plan": { "type": "null" } } },
      "then": { "properties": { "learner_profile": { "properties": { "source": { "const": "fixed_in_xr" } } } } }
    },
    {
      "if": { "required": ["plan"], "properties": { "plan": { "type": "object" } } },
      "then": { "properties": { "learner_profile": { "properties": { "source": { "const": "wah_plan" } } } } }
    }
  ],
  "$defs": {
    "time": { "type": ["number", "null"], "minimum": 0 },
    "labels": { "type": "array", "maxItems": 32, "items": { "type": "string", "minLength": 1, "maxLength": 200 } },
    "scenario_config": {
      "type": "object",
      "description": "1.5. What the learner actually experienced: the preset plus any overrides.",
      "required": ["mode", "preset", "question_timeout_s", "error_pause", "lightning_before_question", "overrides_applied"],
      "properties": {
        "mode": { "enum": ["study", "training", null] },
        "preset": { "enum": ["basic", "intermediate", "expert"] },
        "question_timeout_s": { "type": "number", "minimum": 5, "maximum": 120 },
        "error_pause": { "type": "boolean" },
        "lightning_before_question": { "type": "boolean" },
        "overrides_applied": { "type": "array", "items": { "enum": ["preset", "question_timeout_s", "error_pause", "lightning_before_question"] } }
      }
    }
  }
}
